{
  "verse_id": "GEN-1-1",
  "section_1_sacred_text": {
    "original_script": "בְּרֵאשִׁית בָּרָא אֱלֹהִים אֵת הַשָּׁמַיִם וְאֵת הָאָרֶץ",
    "faithful_direct_translation": "In beginning, God created the heavens and the earth.",
    "standalone_english_translation": "In the beginning God created the heavens and the earth.",
    "amplified_narrative_translation": "At the very beginning of time, the Eternal God brought into existence from nothing the vast expanse of the heavens above and the solid earth beneath."
  },
  "section_2_exegetical_synthesis": {
    "literal_primary_filter": [
      "The opening verse establishes God as the preexistent Creator.",
      "Hebrew 'bara' indicates ex nihilo creation, unique to divine action.",
      "The dual objects 'heavens and earth' form a merism representing totality."
    ],
    "prophetic_typology_and_intertextuality": {
      "type_shadow": "The creation week prefigures the new creation in Christ (2 Cor 5:17)",
      "antitype_fulfillment": "Christ as the Word through whom all things were made (John 1:1-3)",
      "progression_notes": "From physical creation to spiritual regeneration"
    },
    "linguistic_mechanics_and_names": [
      {
        "entry": "בְּרֵאשִׁית (bereshit, 'in beginning')",
        "theological_significance": "Absolute temporal beginning, establishing God's eternality"
      },
      {
        "entry": "אֱלֹהִים (elohim, 'God')",
        "theological_significance": "Plural of majesty indicating divine fullness and Trinity"
      }
    ],
    "literary_devices": "The verse employs a chiastic structure with God at the center",
    "numerical_and_gematria_significance": "The number one establishes monotheism and divine unity",
    "historical_context_and_chronology": {
      "dates": "c. 4004 BC (Ussher chronology) or indeterminate antiquity",
      "context": "Ancient Near Eastern cosmogonies provide contrast to biblical monotheism"
    },
    "socio_political_matrix": "Written to counter pagan creation myths and establish Yahweh's supremacy",
    "geospatial_and_physical_geography": {
      "modern_location": "Universal - not location-specific",
      "coordinates": {
        "lat": 0.0,
        "long": 0.0
      },
      "altitude_m": 0,
      "terrain_climate_characteristics": "Pre-creation cosmic context"
    },
    "archaeological_confirmation": "No physical artifacts predate creation; manuscript evidence supports textual integrity",
    "aggregate_analogia_scriptura": "This verse connects to John 1:1-3, Hebrews 11:3, Revelation 4:11, establishing the theological foundation for all Scripture"
  },
  "section_3_life_application": "Recognize God as the sovereign Creator who brought you into existence with purpose. Your life is not random but designed by the eternal God who spoke worlds into being."
}
